title,pmid,link,doi_link,keywords,abstract,citations,abstract_summary
MedKPL: A heterogeneous knowledge enhanced prompt learning framework for transferable diagnosis.,37315832,https://pubmed.ncbi.nlm.nih.gov/37315832/,https://doi.org/10.1016/j.jbi.2023.104417,"['Knowledge Integration', 'Natural Language Processing', 'Prompt Learning', 'Text Classification']","Artificial Intelligence (AI) based diagnosis systems have emerged as powerful tools to reform traditional medical care. Each clinician now wants to have his own intelligent diagnostic partner to expand the range of services he can provide. However, the implementation of intelligent decision support systems based on clinical note has been hindered by the lack of extensibility of end-to-end AI diagnosis algorithms. When reading a clinical note, expert clinicians make inferences with relevant medical knowledge, which serve as prompts for making accurate diagnoses. Therefore, external medical knowledge is commonly employed as an augmentation for medical text classification tasks. Existing methods, however, cannot integrate knowledge from various knowledge sources as prompts nor can fully utilize explicit and implicit knowledge. To address these issues, we propose a Medical Knowledge-enhanced Prompt Learning (MedKPL) diagnostic framework for transferable clinical note classification. Firstly, to overcome the heterogeneity of knowledge sources, such as knowledge graphs or medical QA databases, MedKPL uniform the knowledge relevant to the disease into text sequences of fixed format. Then, MedKPL integrates medical knowledge into the prompt designed for context representation. Therefore, MedKPL can integrate knowledge into the models to enhance diagnostic performance and effectively transfer to new diseases by using relevant disease knowledge. The results of our experiments on two medical datasets demonstrate that our method yields superior medical text classification results and performs better in cross-departmental transfer tasks under few-shot or even zero-shot settings. These findings demonstrate that our MedKPL framework has the potential to improve the interpretability and transferability of current diagnostic systems.",1,Artificial Intelligence (AI) based diagnosis systems have emerged as powerful tools to reform traditional medical care.
"kboolnet: a toolkit for the verification, validation, and visualization of reaction-contingency (rxncon) models.",37308855,https://pubmed.ncbi.nlm.nih.gov/37308855/,https://doi.org/10.1186/s12859-023-05329-6,"['Boolean networks', 'Cell signaling', 'Computational modeling', 'Network biology', 'Rxncon']","Computational models of cell signaling networks are extremely useful tools for the exploration of underlying system behavior and prediction of response to various perturbations. By representing signaling cascades as executable Boolean networks, the previously developed rxncon (""reaction-contingency"") formalism and associated Python package enable accurate and scalable modeling of signal transduction even in large (thousands of components) biological systems. The models are split into reactions, which generate states, and contingencies, that impinge on reactions; this avoids the so-called ""combinatorial explosion"" of system size. Boolean description of the biological system compensates for the poor availability of kinetic parameters which are necessary for quantitative models. Unfortunately, few tools are available to support rxncon model development, especially for large, intricate systems.",1,"The rxncon (""reaction-contingency"") formalism and associated Python package enable accurate and scalable modeling of signal transduction."
Detecting patterns of accessory genome coevolution in Staphylococcus aureus using data from thousands of genomes.,37296404,https://pubmed.ncbi.nlm.nih.gov/37296404/,https://doi.org/10.1186/s12859-023-05363-4,"['Genetic interaction', 'Genomics', 'Horizontal gene transfer', 'Microbial genomics', 'Software', 'Staphylococcus aureus']","Bacterial genomes exhibit widespread horizontal gene transfer, resulting in highly variable genome content that complicates the inference of genetic interactions. In this study, we develop a method for detecting coevolving genes from large datasets of bacterial genomes based on pairwise comparisons of closely related individuals, analogous to a pedigree study in eukaryotic populations. We apply our method to pairs of genes from the Staphylococcus aureus accessory genome of over 75,000 annotated gene families using a database of over 40,000 whole genomes. We find many pairs of genes that appear to be gained or lost in a coordinated manner, as well as pairs where the gain of one gene is associated with the loss of the other. These pairs form networks of rapidly coevolving genes, primarily consisting of genes involved in virulence, mechanisms of horizontal gene transfer, and antibiotic resistance, particularly the SCCmec complex. While we focus on gene gain and loss, our method can also detect genes that tend to acquire substitutions in tandem, or genotype-phenotype or phenotype-phenotype coevolution. Finally, we present the R package DeCoTUR that allows for the computation of our method.",3,"Bacterial genomes exhibit widespread horizontal gene transfer, resulting in highly variable genome content. We find many pairs of genes that appear to be gained or lost in a coordinated manner."
Finding motifs using DNA images derived from sparse representations.,37294804,https://pubmed.ncbi.nlm.nih.gov/37294804/,https://doi.org/10.1093/bioinformatics/btad378,[],"Motifs play a crucial role in computational biology, as they provide valuable information about the binding specificity of proteins. However, conventional motif discovery methods typically rely on simple combinatoric or probabilistic approaches, which can be biased by heuristics such as substring-masking for multiple motif discovery. In recent years, deep neural networks have become increasingly popular for motif discovery, as they are capable of capturing complex patterns in data. Nonetheless, inferring motifs from neural networks remains a challenging problem, both from a modeling and computational standpoint, despite the success of these networks in supervised learning tasks.",1,"Motifs play a crucial role in computational biology, as they provide valuable information about the binding specificity of proteins."
Large-Scale Modeling of Sparse Protein Kinase Activity Data.,37294674,https://pubmed.ncbi.nlm.nih.gov/37294674/,https://doi.org/10.1021/acs.jcim.3c00132,[],"Protein kinases are a protein family that plays an important role in several complex diseases such as cancer and cardiovascular and immunological diseases. Protein kinases have conserved ATP binding sites, which when targeted can lead to similar activities of inhibitors against different kinases. This can be exploited to create multitarget drugs. On the other hand, selectivity (lack of similar activities) is desirable in order to avoid toxicity issues. There is a vast amount of protein kinase activity data in the public domain, which can be used in many different ways. Multitask machine learning models are expected to excel for these kinds of data sets because they can learn from implicit correlations between tasks (in this case activities against a variety of kinases). However, multitask modeling of sparse data poses two major challenges: (i) creating a balanced train-test split without data leakage and (ii) handling missing data. In this work, we construct a protein kinase benchmark set composed of two balanced splits without data leakage, using random and dissimilarity-driven cluster-based mechanisms, respectively. This data set can be used for benchmarking and developing protein kinase activity prediction models. Overall, the performance on the dissimilarity-driven cluster-based split is lower than on random split-based sets for all models, indicating poor generalizability of models. Nevertheless, we show that multitask deep learning models, on this very sparse data set, outperform single-task deep learning and tree-based models. Finally, we demonstrate that data imputation does not improve the performance of (multitask) models on this benchmark set.",2,Protein kinases are a protein family that plays an important role in several complex diseases such as cancer and cardiovascular and immunological diseases.
Hebbian learning with elasticity explains how the spontaneous motor tempo affects music performance synchronization.,37285380,https://pubmed.ncbi.nlm.nih.gov/37285380/,https://doi.org/10.1371/journal.pcbi.1011154,[],"A musician's spontaneous rate of movement, called spontaneous motor tempo (SMT), can be measured while spontaneously playing a simple melody. Data shows that the SMT influences the musician's tempo and synchronization. In this study we present a model that captures these phenomena. We review the results from three previously-published studies: solo musical performance with a pacing metronome tempo that is different from the SMT, solo musical performance without a metronome at a tempo that is faster or slower than the SMT, and duet musical performance between musicians with matching or mismatching SMTs. These studies showed, respectively, that the asynchrony between the pacing metronome and the musician's tempo grew as a function of the difference between the metronome tempo and the musician's SMT, musicians drifted away from the initial tempo toward the SMT, and the absolute asynchronies were smaller if musicians had matching SMTs. We hypothesize that the SMT constantly acts as a pulling force affecting musical actions at a tempo different from a musician's SMT. To test our hypothesis, we developed a model consisting of a non-linear oscillator with Hebbian tempo learning and a pulling force to the model's spontaneous frequency. While the model's spontaneous frequency emulates the SMT, elastic Hebbian learning allows for frequency learning to match a stimulus' frequency. To test our hypothesis, we first fit model parameters to match the data in the first of the three studies and asked whether this same model would explain the data the remaining two studies without further tuning. Results showed that the model's dynamics allowed it to explain all three experiments with the same set of parameters. Our theory offers a dynamical-systems explanation of how an individual's SMT affects synchronization in realistic music performance settings, and the model also enables predictions about performance settings not yet tested.",3,"A musician's spontaneous rate of movement, called spontaneous motor tempo (SMT), can be measured while spontaneously playing a simple melody."
AIRRSHIP: simulating human B cell receptor repertoire sequences.,37279738,https://pubmed.ncbi.nlm.nih.gov/37279738/,https://doi.org/10.1093/bioinformatics/btad365,[],"Adaptive Immune Receptor Repertoire Sequencing is a rapidly developing field that has advanced understanding of the role of the adaptive immune system in health and disease. Numerous tools have been developed to analyse the complex data produced by this technique but work to compare their accuracy and reliability has been limited. Thorough, systematic assessment of their performance is dependent on the ability to produce high quality simulated datasets with known ground truth. We have developed AIRRSHIP, a flexible and fast Python package that produces synthetic human B cell receptor sequences. AIRRSHIP uses a comprehensive set of reference data to replicate key mechanisms in the immunoglobulin recombination process, with a particular focus on junctional complexity. Repertoires generated by AIRRSHIP are highly similar to published data and all steps in the sequence generation process are recorded. These data can be used to not only determine the accuracy of repertoire analysis tools but can also, by tuning of the large number of user-controllable parameters, give insight into factors that contribute to inaccuracies in results.",1, AIRRSHIP is a flexible and fast Python package that produces synthetic human B cell receptor sequences.
JUMP: replicability analysis of high-throughput experiments with applications to spatial transcriptomic studies.,37279733,https://pubmed.ncbi.nlm.nih.gov/37279733/,https://doi.org/10.1093/bioinformatics/btad366,[],Replicability is the cornerstone of scientific research. The current statistical method for high-dimensional replicability analysis either cannot control the false discovery rate (FDR) or is too conservative.,1,The current statistical method for high-dimensional replicability analysis either cannot control the false discovery rate (FDR) or is too conservative.
Estimating fine age structure and time trends in human contact patterns from coarse contact data: The Bayesian rate consistency model.,37276210,https://pubmed.ncbi.nlm.nih.gov/37276210/,https://doi.org/10.1371/journal.pcbi.1011191,[],"Since the emergence of severe acute respiratory syndrome coronavirus 2 (SARS-CoV-2), large-scale social contact surveys are now longitudinally measuring the fundamental changes in human interactions in the face of the pandemic and non-pharmaceutical interventions. Here, we present a model-based Bayesian approach that can reconstruct contact patterns at 1-year resolution even when the age of the contacts is reported coarsely by 5 or 10-year age bands. This innovation is rooted in population-level consistency constraints in how contacts between groups must add up, which prompts us to call the approach presented here the Bayesian rate consistency model. The model can also quantify time trends and adjust for reporting fatigue emerging in longitudinal surveys through the use of computationally efficient Hilbert Space Gaussian process priors. We illustrate estimation accuracy on simulated data as well as social contact data from Europe and Africa for which the exact age of contacts is reported, and then apply the model to social contact data with coarse information on the age of contacts that were collected in Germany during the COVID-19 pandemic from April to June 2020 across five longitudinal survey waves. We estimate the fine age structure in social contacts during the early stages of the pandemic and demonstrate that social contact intensities rebounded in an age-structured, non-homogeneous manner. The Bayesian rate consistency model provides a model-based, non-parametric, computationally tractable approach for estimating the fine structure and longitudinal trends in social contacts and is applicable to contemporary survey data with coarsely reported age of contacts as long as the exact age of survey participants is reported.",2,Bayesian approach can reconstruct contact patterns at 1-year resolution. This innovation is rooted in population-level consistency constraints in how contacts between groups must add up.
A mixed-effects stochastic model reveals clonal dominance in gene therapy safety studies.,37268887,https://pubmed.ncbi.nlm.nih.gov/37268887/,https://doi.org/10.1186/s12859-023-05269-1,"['-Leaping', 'Clonal dominance', 'E-M algorithm', 'Gene therapy', 'Mixed-effects models', 'Stochastic reaction networks']","Mathematical models of haematopoiesis can provide insights on abnormal cell expansions (clonal dominance), and in turn can guide safety monitoring in gene therapy clinical applications. Clonal tracking is a recent high-throughput technology that can be used to quantify cells arising from a single haematopoietic stem cell ancestor after a gene therapy treatment. Thus, clonal tracking data can be used to calibrate the stochastic differential equations describing clonal population dynamics and hierarchical relationships in vivo.",1,Clonal tracking is a recent high-throughput technology that can be used to quantify cells arising from a single haematopoietic stem cell ancestor after a gene therapy treatment
Disproportionate impacts of COVID-19 in a large US city.,37262052,https://pubmed.ncbi.nlm.nih.gov/37262052/,https://doi.org/10.1371/journal.pcbi.1011149,[],"COVID-19 has disproportionately impacted individuals depending on where they live and work, and based on their race, ethnicity, and socioeconomic status. Studies have documented catastrophic disparities at critical points throughout the pandemic, but have not yet systematically tracked their severity through time. Using anonymized hospitalization data from March 11, 2020 to June 1, 2021 and fine-grain infection hospitalization rates, we estimate the time-varying burden of COVID-19 by age group and ZIP code in Austin, Texas. During this 15-month period, we estimate an overall 23.7% (95% CrI: 22.5-24.8%) infection rate and 29.4% (95% CrI: 28.0-31.0%) case reporting rate. Individuals over 65 were less likely to be infected than younger age groups (11.2% [95% CrI: 10.3-12.0%] vs 25.1% [95% CrI: 23.7-26.4%]), but more likely to be hospitalized (1,965 per 100,000 vs 376 per 100,000) and have their infections reported (53% [95% CrI: 49-57%] vs 28% [95% CrI: 27-30%]). We used a mixed effect poisson regression model to estimate disparities in infection and reporting rates as a function of social vulnerability. We compared ZIP codes ranking in the 75th percentile of vulnerability to those in the 25th percentile, and found that the more vulnerable communities had 2.5 (95% CrI: 2.0-3.0) times the infection rate and only 70% (95% CrI: 60%-82%) the reporting rate compared to the less vulnerable communities. Inequality persisted but declined significantly over the 15-month study period. Our results suggest that further public health efforts are needed to mitigate local COVID-19 disparities and that the CDC's social vulnerability index may serve as a reliable predictor of risk on a local scale when surveillance data are limited.",1,"CVID-19 has disproportionately impacted individuals depending on where they live and work, and based on their race, ethnicity, and socioeconomic status."
MRGCN: cancer subtyping with multi-reconstruction graph convolutional network using full and partial multi-omics dataset.,37255323,https://pubmed.ncbi.nlm.nih.gov/37255323/,https://doi.org/10.1093/bioinformatics/btad353,[],"Cancer is a molecular complex and heterogeneous disease. Each type of cancer is usually composed of several subtypes with different treatment responses and clinical outcomes. Therefore, subtyping is a crucial step in cancer diagnosis and therapy. The rapid advances in high-throughput sequencing technologies provide an increasing amount of multi-omics data, which benefits our understanding of cancer genetic architecture, and yet poses new challenges in multi-omics data integration.",3,Cancer is a molecular complex and heterogeneous disease. Each type of cancer is usually composed of several subtypes with different treatment responses and clinical outcomes.
Nonlinear data fusion over Entity-Relation graphs for Drug-Target Interaction prediction.,37255310,https://pubmed.ncbi.nlm.nih.gov/37255310/,https://doi.org/10.1093/bioinformatics/btad348,[],"The prediction of reliable Drug-Target Interactions (DTIs) is a key task in computer-aided drug design and repurposing. Here, we present a new approach based on data fusion for DTI prediction built on top of the NXTfusion library, which generalizes the Matrix Factorization paradigm by extending it to the nonlinear inference over Entity-Relation graphs.",1,The prediction of reliable Drug-Target Interactions is a key task in computer-aided drug design and repurposing.
The ACPYPE web server for small-molecule MD topology generation.,37252824,https://pubmed.ncbi.nlm.nih.gov/37252824/,https://doi.org/10.1093/bioinformatics/btad350,[],The generation of parameter files for molecular dynamics (MD) simulations of small molecules that are suitable for force fields commonly applied to proteins and nucleic acids is often challenging. The ACPYPE software and website aid the generation of such parameter files.,2,The ACPYPE software and website aid the generation of such parameter files.
IEPAPI: a method for immune epitope prediction by incorporating antigen presentation and immunogenicity.,37232386,https://pubmed.ncbi.nlm.nih.gov/37232386/,https://doi.org/10.1093/bib/bbad171,"['antigen presentation', 'cancer immunotherapy', 'deep learning', 'immunogenicity', 'neoantigen', 'transformer']","CD8+ T cells can recognize peptides presented by class I human leukocyte antigen (HLA-I) of nucleated cells. Exploring this immune mechanism is essential for identifying T-cell vaccine targets in cancer immunotherapy. Over the past decade, the wealth of data generated by experiments has spawned many computational approaches for predicting HLA-I binding, antigen presentation and T-cell immune responses. Nevertheless, existing HLA-I binding and antigen presentation prediction approaches suffer from low precision due to the absence of T-cell receptor (TCR) recognition. Direct modeling of T-cell immune responses is less effective as TCR recognition's mechanism still remains underexplored. Therefore, directly applying these existing methods to screen cancer neoantigens is still challenging. Here, we propose a novel immune epitope prediction method termed IEPAPI by effectively incorporating antigen presentation and immunogenicity. First, IEPAPI employs a transformer-based feature extraction block to acquire representations of peptides and HLA-I proteins. Second, IEPAPI integrates the prediction of antigen presentation prediction into the input of immunogenicity prediction branch to simulate the connection between the biological processes in the T-cell immune response. Quantitative comparison results on an independent antigen presentation test dataset exhibit that IEPAPI outperformed the current state-of-the-art approaches NetMHCpan4.1 and mhcflurry2.0 on 100 (25/25) and 76% (19/25) of the HLA subtypes, respectively. Furthermore, IEPAPI demonstrates the best precision on two independent neoantigen datasets when compared with existing approaches, suggesting that IEPAPI provides a vital tool for T-cell vaccine design.",1,CD8+ T cells can recognize peptides presented by class I human leukocyte antigen (HLA-I) of nucleated cells.
Integrating massive RNA-seq data to elucidate transcriptome dynamics in Drosophila melanogaster.,37232385,https://pubmed.ncbi.nlm.nih.gov/37232385/,https://doi.org/10.1093/bib/bbad177,"['computational methods', 'data integration and quality control', 'gene expression dynamics', 'massively parallel sequencing', 'sequence read archive']","The volume of ribonucleic acid (RNA)-seq data has increased exponentially, providing numerous new insights into various biological processes. However, due to significant practical challenges, such as data heterogeneity, it is still difficult to ensure the quality of these data when integrated. Although some quality control methods have been developed, sample consistency is rarely considered and these methods are susceptible to artificial factors. Here, we developed MassiveQC, an unsupervised machine learning-based approach, to automatically download and filter large-scale high-throughput data. In addition to the read quality used in other tools, MassiveQC also uses the alignment and expression quality as model features. Meanwhile, it is user-friendly since the cutoff is generated from self-reporting and is applicable to multimodal data. To explore its value, we applied MassiveQC to Drosophila RNA-seq data and generated a comprehensive transcriptome atlas across 28 tissues from embryogenesis to adulthood. We systematically characterized fly gene expression dynamics and found that genes with high expression dynamics were likely to be evolutionarily young and expressed at late developmental stages, exhibiting high nonsynonymous substitution rates and low phenotypic severity, and they were involved in simple regulatory programs. We also discovered that human and Drosophila had strong positive correlations in gene expression in orthologous organs, revealing the great potential of the Drosophila system for studying human development and disease.",2,MassiveQC is an unsupervised machine learning-based approach to automatically download and filter large-scale high-throughput data.
Recent trends in RNA informatics: a review of machine learning and deep learning for RNA secondary structure prediction and RNA drug discovery.,37232359,https://pubmed.ncbi.nlm.nih.gov/37232359/,https://doi.org/10.1093/bib/bbad186,"['RNA informatics', 'RNA secondary structure prediction', 'RNA-based therapeutics']","Computational analysis of RNA sequences constitutes a crucial step in the field of RNA biology. As in other domains of the life sciences, the incorporation of artificial intelligence and machine learning techniques into RNA sequence analysis has gained significant traction in recent years. Historically, thermodynamics-based methods were widely employed for the prediction of RNA secondary structures; however, machine learning-based approaches have demonstrated remarkable advancements in recent years, enabling more accurate predictions. Consequently, the precision of sequence analysis pertaining to RNA secondary structures, such as RNA-protein interactions, has also been enhanced, making a substantial contribution to the field of RNA biology. Additionally, artificial intelligence and machine learning are also introducing technical innovations in the analysis of RNA-small molecule interactions for RNA-targeted drug discovery and in the design of RNA aptamers, where RNA serves as its own ligand. This review will highlight recent trends in the prediction of RNA secondary structure, RNA aptamers and RNA drug discovery using machine learning, deep learning and related technologies, and will also discuss potential future avenues in the field of RNA informatics.",6, Computational analysis of RNA sequences constitutes a crucial step in the field of RNA biology.
