title,pmid,link,doi_link,keywords,abstract,citations,abstract_summary
Predicting miRNA-disease associations based on PPMI and attention network.,36959547,https://pubmed.ncbi.nlm.nih.gov/36959547/,https://doi.org/10.1186/s12859-023-05152-z,"['Attention network', 'Deep learning', 'MiRNA-disease association prediction', 'PPMI']","With the development of biotechnology and the accumulation of theories, many studies have found that microRNAs (miRNAs) play an important role in various diseases. Uncovering the potential associations between miRNAs and diseases is helpful to better understand the pathogenesis of complex diseases. However, traditional biological experiments are expensive and time-consuming. Therefore, it is necessary to develop more efficient computational methods for exploring underlying disease-related miRNAs.",3,"With the development of biotechnology and the accumulation of theories, many studies have found that microRNAs (miRNAs) play an important role in various diseases."
Epigenetic modifications: Allusive clues of lncRNA functions in plants.,36950220,https://pubmed.ncbi.nlm.nih.gov/36950220/,https://doi.org/10.1016/j.csbj.2023.03.008,"['Epigenetic regulation', 'Epigenomes', 'LncRNA', 'Plant']","Long non-coding RNAs (lncRNAs) have been verified as flexible and important factors in various biological processes of multicellular eukaryotes, including plants. The respective intricate crosstalk among multiple epigenetic modifications has been examined to some extent. However, only a small proportion of lncRNAs has been functionally well characterized. Moreover, the relationship between lncRNAs and other epigenetic modifications has not been systematically studied. In this mini-review, we briefly summarize the representative biological functions of lncRNAs in developmental programs and environmental responses in plants. In addition, we particularly discuss the intimate relationship between lncRNAs and other epigenetic modifications, and we outline the underlying avenues and challenges for future research on plant lncRNAs.",2,"Long non-coding RNAs (lncRNAs) have been verified as flexible and important factors in various biological processes of multicellular eukaryotes, including plants."
Bayesian kinetic modeling for tracer-based metabolomic data.,36949395,https://pubmed.ncbi.nlm.nih.gov/36949395/,https://doi.org/10.1186/s12859-023-05211-5,"['Bayesian method', 'Kinetic modeling', 'SIRM']","Stable Isotope Resolved Metabolomics (SIRM) is a new biological approach that uses stable isotope tracers such as uniformly [Formula: see text]-enriched glucose ([Formula: see text]-Glc) to trace metabolic pathways or networks at the atomic level in complex biological systems. Non-steady-state kinetic modeling based on SIRM data uses sets of simultaneous ordinary differential equations (ODEs) to quantitatively characterize the dynamic behavior of metabolic networks. It has been increasingly used to understand the regulation of normal metabolism and dysregulation in the development of diseases. However, fitting a kinetic model is challenging because there are usually multiple sets of parameter values that fit the data equally well, especially for large-scale kinetic models. In addition, there is a lack of statistically rigorous methods to compare kinetic model parameters between different experimental groups.",2,Stable Isotope Resolved Metabolomics (SIRM) is a new biological approach that uses stable isotope tracers.
The hidden factor: accounting for covariate effects in power and sample size computation for a binary trait.,36943372,https://pubmed.ncbi.nlm.nih.gov/36943372/,https://doi.org/10.1093/bioinformatics/btad139,[],"Accurate power and sample size estimation is crucial to the design and analysis of genetic association studies. When analyzing a binary trait via logistic regression, important covariates such as age and sex are typically included in the model. However, their effects are rarely properly considered in power or sample size computation during study planning. Unlike when analyzing a continuous trait, the power of association testing between a binary trait and a genetic variant depends, explicitly, on covariate effects, even under the assumption of gene-environment independence. Earlier work recognizes this hidden factor but the implemented methods are not flexible. We thus propose and implement a generalized method for estimating power and sample size for (discovery or replication) association studies of binary traits that (i) accommodates different types of nongenetic covariates E, (ii) deals with different types of G-E relationships, and (iii) is computationally efficient.",1,Accurate power and sample size estimation is crucial to the design and analysis of genetic association studies.
OpticalBERT and OpticalTable-SQA: Text- and Table-Based Language Models for the Optical-Materials Domain.,36940385,https://pubmed.ncbi.nlm.nih.gov/36940385/,https://doi.org/10.1021/acs.jcim.2c01259,[],"Text mining in the optical-materials domain is becoming increasingly important as the number of scientific publications in this area grows rapidly. Language models such as Bidirectional Encoder Representations from Transformers (BERT) have opened up a new era and brought a significant boost to state-of-the-art natural-language-processing (NLP) tasks. In this paper, we present two ""materials-aware"" text-based language models for optical research, OpticalBERT and OpticalPureBERT, which are trained on a large corpus of scientific literature in the optical-materials domain. These two models outperform BERT and previous state-of-the-art models in a variety of text-mining tasks about optical materials. We also release the first ""materials-aware"" table-based language model, OpticalTable-SQA. This is a querying facility that solicits answers to questions about optical materials using tabular information that pertains to this scientific domain. The OpticalTable-SQA model was realized by fine-tuning the Tapas-SQA model using a manually annotated OpticalTableQA data set which was curated specifically for this work. While preserving its sequential question-answering performance on general tables, the OpticalTable-SQA model significantly outperforms Tapas-SQA on optical-materials-related tables. All models and data sets are available to the optical-materials-science community.",1,Text mining in the optical-materials domain is becoming increasingly important as the number of scientific publications in this area grows rapidly.
Metheor: Ultrafast DNA methylation heterogeneity calculation from bisulfite read alignments.,36940213,https://pubmed.ncbi.nlm.nih.gov/36940213/,https://doi.org/10.1371/journal.pcbi.1010946,[],"Phased DNA methylation states within bisulfite sequencing reads are valuable source of information that can be used to estimate epigenetic diversity across cells as well as epigenomic instability in individual cells. Various measures capturing the heterogeneity of DNA methylation states have been proposed for a decade. However, in routine analyses on DNA methylation, this heterogeneity is often ignored by computing average methylation levels at CpG sites, even though such information exists in bisulfite sequencing data in the form of phased methylation states, or methylation patterns. In this study, to facilitate the application of the DNA methylation heterogeneity measures in downstream epigenomic analyses, we present a Rust-based, extremely fast and lightweight bioinformatics toolkit called Metheor. As the analysis of DNA methylation heterogeneity requires the examination of pairs or groups of CpGs throughout the genome, existing softwares suffer from high computational burden, which almost make a large-scale DNA methylation heterogeneity studies intractable for researchers with limited resources. In this study, we benchmark the performance of Metheor against existing code implementations for DNA methylation heterogeneity measures in three different scenarios of simulated bisulfite sequencing datasets. Metheor was shown to dramatically reduce the execution time up to 300-fold and memory footprint up to 60-fold, while producing identical results with the original implementation, thereby facilitating a large-scale study of DNA methylation heterogeneity profiles. To demonstrate the utility of the low computational burden of Metheor, we show that the methylation heterogeneity profiles of 928 cancer cell lines can be computed with standard computing resources. With those profiles, we reveal the association between DNA methylation heterogeneity and various omics features. Source code for Metheor is at https://github.com/dohlee/metheor and is freely available under the GPL-3.0 license.",2,"Metheor is a Rust-based, extremely fast and lightweight bioinformatics toolkit."
IK-DDI: a novel framework based on instance position embedding and key external text for DDI extraction.,36932655,https://pubmed.ncbi.nlm.nih.gov/36932655/,https://doi.org/10.1093/bib/bbad099,"['DDI extraction', 'drug matching', 'instance position embedding', 'key external text']","Determining drug-drug interactions (DDIs) is an important part of pharmacovigilance and has a vital impact on public health. Compared with drug trials, obtaining DDI information from scientific articles is a faster and lower cost but still a highly credible approach. However, current DDI text extraction methods consider the instances generated from articles to be independent and ignore the potential connections between different instances in the same article or sentence. Effective use of external text data could improve prediction accuracy, but existing methods cannot extract key information from external data accurately and reasonably, resulting in low utilization of external data. In this study, we propose a DDI extraction framework, instance position embedding and key external text for DDI (IK-DDI), which adopts instance position embedding and key external text to extract DDI information. The proposed framework integrates the article-level and sentence-level position information of the instances into the model to strengthen the connections between instances generated from the same article or sentence. Moreover, we introduce a comprehensive similarity-matching method that uses string and word sense similarity to improve the matching accuracy between the target drug and external text. Furthermore, the key sentence search method is used to obtain key information from external data. Therefore, IK-DDI can make full use of the connection between instances and the information contained in external text data to improve the efficiency of DDI extraction. Experimental results show that IK-DDI outperforms existing methods on both macro-averaged and micro-averaged metrics, which suggests our method provides complete framework that can be used to extract relationships between biomedical entities and process external text data.",1,Determining drug-drug interactions (DDIs) is an important part of pharmacovigilance and has a vital impact on public health.
Genetics and precision health: the ecological fallacy and artificial intelligence solutions.,36927508,https://pubmed.ncbi.nlm.nih.gov/36927508/,https://doi.org/10.1186/s13040-023-00327-z,[],,1,
Avoiding background knowledge: literature based discovery from important information.,36918777,https://pubmed.ncbi.nlm.nih.gov/36918777/,https://doi.org/10.1186/s12859-022-04892-8,"['Literature based discovery', 'Machine learning', 'Subject–predicate–object triples', 'Timeslicing gold standard']","Automatic literature based discovery attempts to uncover new knowledge by connecting existing facts: information extracted from existing publications in the form of [Formula: see text] and [Formula: see text] relations can be simply connected to deduce [Formula: see text]. However, using this approach, the quantity of proposed connections is often too vast to be useful. It can be reduced by using subject[Formula: see text](predicate)[Formula: see text]object triples as the [Formula: see text] relations, but too many proposed connections remain for manual verification.",1,Automatic literature based discovery attempts to uncover new knowledge by connecting existing facts. The quantity of proposed connections is often too vast to be useful.
Structure-activity correlations for peptaibols obtained from clade Longibrachiatum of ,36915379,https://pubmed.ncbi.nlm.nih.gov/36915379/,https://doi.org/10.1016/j.csbj.2023.02.046,"['Molecular dynamics simulations', 'Peptaibols', 'Peptide folding', 'Structure-activity relationship (SAR)', 'Trichoderma']",Integrated disease management and plant protection have been discussed with much fervor in the past decade due to the rising environmental concerns of using industrially produced pesticides. Members of the genus ,1, Integrated disease management and plant protection have been discussed with much fervor in the past decade due to the rising environmental concerns of using industrially produced pesticides.
AisNet: A Universal Interatomic Potential Neural Network with Encoded Local Environment Features.,36897781,https://pubmed.ncbi.nlm.nih.gov/36897781/,https://doi.org/10.1021/acs.jcim.3c00077,[],"This paper proposes a new interatomic potential energy neural network, AisNet, which can efficiently predict atomic energies and forces covering different molecular and crystalline materials by encoding universal local environment features, such as elements and atomic positions. Inspired by the framework of SchNet, AisNet consists of an encoding module combining autoencoder with embedding, the triplet loss function and an atomic central symmetry function (ACSF), an interaction module with a periodic boundary condition (PBC), and a prediction module. In molecules, the prediction accuracy of AisNet is comparabel with SchNet on the MD17 dataset, mainly attributed to the effective capture of chemical functional groups through the interaction module. In selected metal and ceramic material datasets, the introduction of ACSF improves the overall accuracy of AisNet by an average of 16.8% for energy and 28.6% for force. Furthermore, a close relationship is found between the feature ratio (i.e., ACSF and embedding) and the force prediction errors, exhibiting similar spoon-shaped curves in the datasets of Cu and HfO",1,"AisNet consists of an encoding module combining autoencoder with embedding, the triplet loss function and an atomic central symmetry function."
"Identification of a PD1/PD-L1 inhibitor by structure-based pharmacophore modelling, virtual screening, molecular docking and biological evaluation.",36897739,https://pubmed.ncbi.nlm.nih.gov/36897739/,https://doi.org/10.1002/minf.202200254,"['PD-L1', 'chemoinformatics', 'drug repurposing', 'immunotherapy', 'sepsis']","PD-1/PD-L1 is a critical druggable target for immunotherapy against sepsis. Chemoinformatics techniques involved the structure-based 3D pharmacophore model development followed by virtual screening of small molecule databases to identify the small molecules against PD-L1 pathway inhibition. Raltitrexed and Safinamide act as potent repurposed drugs, and three other Specs database compounds using in silico methods. These compounds were screened based on the pharmacophore fit score and binding affinity towards the active site of the PD-L1 protein. In silico pharmacokinetic profiling of these screened compounds was done to test their biological activity. Next, experimental validation of the best four virtually screened hits was done in vitro for its hemocompatibility and cytotoxicity. Among these, Raltitrexed, Safinamide and Specs compound (AK-968/40642641) effectively increased the proliferation of immune cells and IFN-γ production. These compounds can act as potent PDL-1 inhibitors for adjuvant therapy against sepsis.",3,PD-1/PD-L1 is a critical druggable target for immunotherapy against sepsis.
ExamPle: explainable deep learning framework for the prediction of plant small secreted peptides.,36897030,https://pubmed.ncbi.nlm.nih.gov/36897030/,https://doi.org/10.1093/bioinformatics/btad108,[],"Plant Small Secreted Peptides (SSPs) play an important role in plant growth, development, and plant-microbe interactions. Therefore, the identification of SSPs is essential for revealing the functional mechanisms. Over the last few decades, machine learning-based methods have been developed, accelerating the discovery of SSPs to some extent. However, existing methods highly depend on handcrafted feature engineering, which easily ignores the latent feature representations and impacts the predictive performance.",1,"Plant Small Secreted Peptides (SSPs) play an important role in plant growth, development, and plant-microbe interactions."
Are Deep Learning Structural Models Sufficiently Accurate for Virtual Screening? Application of Docking Algorithms to AlphaFold2 Predicted Structures.,36892986,https://pubmed.ncbi.nlm.nih.gov/36892986/,https://doi.org/10.1021/acs.jcim.2c01270,[],"Machine learning-based protein structure prediction algorithms, such as RosettaFold and AlphaFold2, have greatly impacted the structural biology field, arousing a fair amount of discussion around their potential role in drug discovery. While there are few preliminary studies addressing the usage of these models in virtual screening, none of them focus on the prospect of hit-finding in a real-world virtual screen with a model based on low prior structural information. In order to address this, we have developed an AlphaFold2 version where we exclude all structural templates with more than 30% sequence identity from the model-building process. In a previous study, we used those models in conjunction with state-of-the-art free energy perturbation methods and demonstrated that it is possible to obtain quantitatively accurate results. In this work, we focus on using these structures in rigid receptor-ligand docking studies. Our results indicate that using out-of-the-box Alphafold2 models is not an ideal scenario for virtual screening campaigns; in fact, we strongly recommend to include some post-processing modeling to drive the binding site into a more realistic holo model.",10,"Machine learning-based protein structure prediction algorithms, such as RosettaFold and AlphaFold2, have greatly impacted the structural biology field."
Identification of significant gene expression changes in multiple perturbation experiments using knockoffs.,36892174,https://pubmed.ncbi.nlm.nih.gov/36892174/,https://doi.org/10.1093/bib/bbad084,"['chemoinformatics', 'deep learning', 'gene expression', 'genomics', 'knockoffs']","Large-scale multiple perturbation experiments have the potential to reveal a more detailed understanding of the molecular pathways that respond to genetic and environmental changes. A key question in these studies is which gene expression changes are important for the response to the perturbation. This problem is challenging because (i) the functional form of the nonlinear relationship between gene expression and the perturbation is unknown and (ii) identification of the most important genes is a high-dimensional variable selection problem. To deal with these challenges, we present here a method based on the model-X knockoffs framework and Deep Neural Networks to identify significant gene expression changes in multiple perturbation experiments. This approach makes no assumptions on the functional form of the dependence between the responses and the perturbations and it enjoys finite sample false discovery rate control for the selected set of important gene expression responses. We apply this approach to the Library of Integrated Network-Based Cellular Signature data sets which is a National Institutes of Health Common Fund program that catalogs how human cells globally respond to chemical, genetic and disease perturbations. We identified important genes whose expression is directly modulated in response to perturbation with anthracycline, vorinostat, trichostatin-a, geldanamycin and sirolimus. We compare the set of important genes that respond to these small molecules to identify co-responsive pathways. Identification of which genes respond to specific perturbation stressors can provide better understanding of the underlying mechanisms of disease and advance the identification of new drug targets.",2,Large-scale multiple perturbation experiments have the potential to reveal a more detailed understanding of the molecular pathways that respond to genetic and environmental changes.
EG-TransUNet: a transformer-based U-Net with enhanced and guided models for biomedical image segmentation.,36882688,https://pubmed.ncbi.nlm.nih.gov/36882688/,https://doi.org/10.1186/s12859-023-05196-1,"['Channel spatial attention', 'Medical image segmentation', 'Progressive enhancement module', 'Self-attention', 'Semantic guidance attention', 'Transformer']","Although various methods based on convolutional neural networks have improved the performance of biomedical image segmentation to meet the precision requirements of medical imaging segmentation task, medical image segmentation methods based on deep learning still need to solve the following problems: (1) Difficulty in extracting the discriminative feature of the lesion region in medical images during the encoding process due to variable sizes and shapes; (2) difficulty in fusing spatial and semantic information of the lesion region effectively during the decoding process due to redundant information and the semantic gap. In this paper, we used the attention-based Transformer during the encoder and decoder stages to improve feature discrimination at the level of spatial detail and semantic location by its multihead-based self-attention. In conclusion, we propose an architecture called EG-TransUNet, including three modules improved by a transformer: progressive enhancement module, channel spatial attention, and semantic guidance attention. The proposed EG-TransUNet architecture allowed us to capture object variabilities with improved results on different biomedical datasets. EG-TransUNet outperformed other methods on two popular colonoscopy datasets (Kvasir-SEG and CVC-ClinicDB) by achieving 93.44% and 95.26% on mDice. Extensive experiments and visualization results demonstrate that our method advances the performance on five medical segmentation datasets with better generalization ability.",4, EG-TransUNet outperformed other methods on two popular colonoscopy datasets.
PhaGAA: an integrated web server platform for phage genome annotation and analysis.,36882183,https://pubmed.ncbi.nlm.nih.gov/36882183/,https://doi.org/10.1093/bioinformatics/btad120,[],"Phage genome annotation plays a key role in the design of phage therapy. To date, there have been various genome annotation tools for phages, but most of these tools focus on mono-functional annotation and have complex operational processes. Accordingly, comprehensive and user-friendly platforms for phage genome annotation are needed.",3,"To date, there have been various genome annotation tools for phages."
NDEx IQuery: a multi-method network gene set analysis leveraging the Network Data Exchange.,36882166,https://pubmed.ncbi.nlm.nih.gov/36882166/,https://doi.org/10.1093/bioinformatics/btad118,[],The investigation of sets of genes using biological pathways is a common task for researchers and is supported by a wide variety of software tools. This type of analysis generates hypotheses about the biological processes that are active or modulated in a specific experimental context.,6,The investigation of sets of genes using biological pathways is a common task for researchers.
Machine learning reveals STAT motifs as predictors for GR-mediated gene repression.,36879886,https://pubmed.ncbi.nlm.nih.gov/36879886/,https://doi.org/10.1016/j.csbj.2023.02.015,"['ChIPseq', 'ChIPseq, chromatin immunoprecipitation sequencing', 'Epigenomics', 'Glucocorticoid receptor', 'Machine-learning', 'RNAseq', 'Repression', 'STAT', 'STAT, signal transducer and activator of transcription']","Glucocorticoids are potent immunosuppressive drugs, but long-term treatment leads to severe side-effects. While there is a commonly accepted model for GR-mediated gene activation, the mechanism behind repression remains elusive. Understanding the molecular action of the glucocorticoid receptor (GR) mediated gene repression is the first step towards developing novel therapies. We devised an approach that combines multiple epigenetic assays with 3D chromatin data to find sequence patterns predicting gene expression change. We systematically tested> 100 models to evaluate the best way to integrate the data types and found that GR-bound regions hold most of the information needed to predict the polarity of Dex-induced transcriptional changes. We confirmed NF-κB motif family members as predictors for gene repression and identified STAT motifs as additional negative predictors.",1,"Glucocorticoids are potent immunosuppressive drugs, but long-term treatment leads to severe side-effects."
