title,pmid,link,doi_link,keywords,abstract,citations,abstract_summary
E2EDA: Protein Domain Assembly Based on End-to-End Deep Learning.,37788318,https://pubmed.ncbi.nlm.nih.gov/37788318/,https://doi.org/10.1021/acs.jcim.3c01387,[],"With the development of deep learning, almost all single-domain proteins can be predicted at experimental resolution. However, the structure prediction of multi-domain proteins remains a challenge. Achieving end-to-end protein domain assembly and further improving the accuracy of the full-chain modeling by accurately predicting inter-domain orientation while improving the assembly efficiency will provide significant insights into structure-based drug discovery. In this work, we propose an End-to-End Domain Assembly method based on deep learning, named E2EDA. We first develop RMNet, an EfficientNetV2-based deep learning model that fuses multiple features using an attention mechanism to predict inter-domain rigid motion. Then, the predicted rigid motions are transformed into inter-domain spatial transformations to directly assemble the full-chain model. Finally, the scoring strategy RMscore is designed to select the best model from multiple assembled models. The experimental results show that the average TM-score of the model assembled by E2EDA on the benchmark set (282) is 0.827, which is better than those of other domain assembly methods SADA (0.792) and DEMO (0.730). Meanwhile, on our constructed multi-domain data set from AlphaFold DB, the model reassembled by E2EDA is 7.0% higher in TM-score compared to the full-chain model predicted by AlphaFold2, indicating that E2EDA can capture more accurate inter-domain orientations to improve the quality of the model predicted by AlphaFold2. Furthermore, compared to SADA and AlphaFold2, E2EDA reduced the average runtime on the benchmark by 64.7% and 19.2%, respectively, indicating that E2EDA can significantly improve assembly efficiency through an end-to-end approach. The online server is available at http://zhanglab-bioinf.com/E2EDA.",1,E2EDA is an End-to-End Domain Assembly method based on deep learning.
Surfaces: a software to quantify and visualize interactions within and between proteins and ligands.,37788107,https://pubmed.ncbi.nlm.nih.gov/37788107/,https://doi.org/10.1093/bioinformatics/btad608,[],"Computational methods for the quantification and visualization of the relative contribution of molecular interactions to the stability of biomolecular structures and complexes are fundamental to understand, modulate and engineer biological processes. Here, we present Surfaces, an easy to use, fast and customizable software for quantification and visualization of molecular interactions based on the calculation of surface areas in contact. Surfaces calculations shows equivalent or better correlations with experimental data as computationally expensive methods based on molecular dynamics.",1,"Surfaces is an easy to use, fast and customizable software for quantification and visualization of molecular interactions based on the calculation of surface areas in contact."
Fair and equitable AI in biomedical research and healthcare: Social science perspectives.,37783540,https://pubmed.ncbi.nlm.nih.gov/37783540/,https://doi.org/10.1016/j.artmed.2023.102658,"['Bias', 'Discrimination', 'Health equity', 'Inequalities', 'Medicine']","Artificial intelligence (AI) offers opportunities but also challenges for biomedical research and healthcare. This position paper shares the results of the international conference ""Fair medicine and AI"" (online 3-5 March 2021). Scholars from science and technology studies (STS), gender studies, and ethics of science and technology formulated opportunities, challenges, and research and development desiderata for AI in healthcare. AI systems and solutions, which are being rapidly developed and applied, may have undesirable and unintended consequences including the risk of perpetuating health inequalities for marginalized groups. Socially robust development and implications of AI in healthcare require urgent investigation. There is a particular dearth of studies in human-AI interaction and how this may best be configured to dependably deliver safe, effective and equitable healthcare. To address these challenges, we need to establish diverse and interdisciplinary teams equipped to develop and apply medical AI in a fair, accountable and transparent manner. We formulate the importance of including social science perspectives in the development of intersectionally beneficent and equitable AI for biomedical research and healthcare, in part by strengthening AI health evaluation.",1,Socially robust development and implications of AI in healthcare require urgent investigation.
YASARA Model-Interactive Molecular Modeling from Two Dimensions to Virtual Realities.,37782001,https://pubmed.ncbi.nlm.nih.gov/37782001/,https://doi.org/10.1021/acs.jcim.3c01136,[],"The industry's transition from three-dimensional (3D) glasses to virtual reality (VR) headsets has left modelers stranded without hardware supply, since walking around and waving arms in a virtual world is a great experience but also very tiring when doing time-intensive modeling work. We present a novel software implementation that uses a VR headset while sitting at a desk in front of the normal screen, which is beamed into the virtual reality together with keyboard, mouse, and chair using the headset's cameras and an extra tracker attached to the seat-back. Compared to 3D glasses, this yields a comparably relaxing but much more immersive workplace and provides additional possibilities such as taking molecules into one's hands, standing up, and walking or teleporting through the models. This VR functionality has been combined with a molecular graphics engine based on Vulkan, a next-generation cross-platform application programming interface (API) for GPUs and the successor of the widely used Open Graphics Library (OpenGL). It is built into the YASARA Model program, which includes many features like small and large molecule builders, electron densities, partial surfaces, contact analysis, coordinate manipulation, and animations. Interactive tutorials are provided to guide modelers into VR and familiarize them with the molecular modeling features. YASARA Model is available for Linux, Windows, Android, and MacOS (the latter without VR) with an introductory video at www.YASARA.org/vr.",2,The industry's transition from three-dimensional (3D) glasses to virtual reality (VR) headsets has left modelers stranded without hardware supply.
MMiKG: a knowledge graph-based platform for path mining of microbiota-mental diseases interactions.,37779250,https://pubmed.ncbi.nlm.nih.gov/37779250/,https://doi.org/10.1093/bib/bbad340,"['MGB axis', 'gut microbiota', 'intermediate', 'knowledge graph', 'mental disease']","The microbiota-gut-brain axis denotes a two-way system of interactions between the gut and the brain, comprising three key components: (1) gut microbiota, (2) intermediates and (3) mental ailments. These constituents communicate with one another to induce changes in the host's mood, cognition and demeanor. Knowledge concerning the regulation of the host central nervous system by gut microbiota is fragmented and mostly confined to disorganized or semi-structured unrestricted texts. Such a format hinders the exploration and comprehension of unknown territories or the further advancement of artificial intelligence systems. Hence, we collated crucial information by scrutinizing an extensive body of literature, amalgamated the extant knowledge of the microbiota-gut-brain axis and depicted it in the form of a knowledge graph named MMiKG, which can be visualized on the GraphXR platform and the Neo4j database, correspondingly. By merging various associated resources and deducing prospective connections between gut microbiota and the central nervous system through MMiKG, users can acquire a more comprehensive perception of the pathogenesis of mental disorders and generate novel insights for advancing therapeutic measures. As a free and open-source platform, MMiKG can be accessed at http://yangbiolab.cn:8501/ with no login requirement.",1,The microbiota-gut-brain axis denotes a two-way system of interactions between the gut and the brain.
Ten quick tips for building FAIR workflows.,37768885,https://pubmed.ncbi.nlm.nih.gov/37768885/,https://doi.org/10.1371/journal.pcbi.1011369,[],"Research data is accumulating rapidly and with it the challenge of fully reproducible science. As a consequence, implementation of high-quality management of scientific data has become a global priority. The FAIR (Findable, Accesible, Interoperable and Reusable) principles provide practical guidelines for maximizing the value of research data; however, processing data using workflows-systematic executions of a series of computational tools-is equally important for good data management. The FAIR principles have recently been adapted to Research Software (FAIR4RS Principles) to promote the reproducibility and reusability of any type of research software. Here, we propose a set of 10 quick tips, drafted by experienced workflow developers that will help researchers to apply FAIR4RS principles to workflows. The tips have been arranged according to the FAIR acronym, clarifying the purpose of each tip with respect to the FAIR4RS principles. Altogether, these tips can be seen as practical guidelines for workflow developers who aim to contribute to more reproducible and sustainable computational science, aiming to positively impact the open science and FAIR community.",1,"FAIR (Findable, Accesible, Interoperable and Reusable) principles provide practical guidelines for maximizing the value of research data."
Multimodal analysis and the oncology patient: Creating a hospital system for integrated diagnostics and discovery.,37767106,https://pubmed.ncbi.nlm.nih.gov/37767106/,https://doi.org/10.1016/j.csbj.2023.09.014,"['Artificial Intelligence', 'Computational Oncology', 'Digital Pathology', 'Health data', 'Integrated Diagnostics and Discovery', 'Multimodal Analysis', 'Radiomics']","We propose that an information technology and computational framework that would unify access to hospital digital information silos, and enable integration of this information using machine learning methods, would bring a new paradigm to patient management and research. This is the core principle of Integrated Diagnostics (ID): ",1,"An information technology and computational framework that would unify access to hospital digital information silos, and enable integration of this information using machine learning methods, would bring a new paradigm to patient management"
Designing and development of multi-epitope chimeric vaccine against Helicobacter pylori by exploring its entire immunogenic epitopes: an immunoinformatic approach.,37740175,https://pubmed.ncbi.nlm.nih.gov/37740175/,https://doi.org/10.1186/s12859-023-05454-2,"['Helicobacter pylori', 'Immunoinformatics', 'Infection', 'Multi-epitopes', 'Vaccine']","Helicobacter pylori is a prominent causative agent of gastric ulceration, gastric adenocarcinoma and gastric lymphoma and have been categorised as a group 1 carcinogen by WHO. The treatment of H. pylori with proton pump inhibitors and antibiotics is effective but also leads to increased antibiotic resistance, patient dissatisfaction, and chances of reinfection. Therefore, an effective vaccine remains the most suitable prophylactic option for mass administration against this infection.",1,"Helicobacter pylori is a prominent causative agent of gastric ulceration, gastric adenocarcinoma and gastric lymphoma."
PLPCA: Persistent Laplacian-Enhanced PCA for Microarray Data Analysis.,37738663,https://pubmed.ncbi.nlm.nih.gov/37738663/,https://doi.org/10.1021/acs.jcim.3c01023,[],"Over the years, Principal Component Analysis (PCA) has served as the baseline approach for dimensionality reduction in gene expression data analysis. Its primary objective is to identify a subset of disease-causing genes from a vast pool of thousands of genes. However, PCA possesses inherent limitations that hinder its interpretability, introduce class ambiguity, and fail to capture complex geometric structures in the data. Although these limitations have been partially addressed in the literature by incorporating various regularizers, such as graph Laplacian regularization, existing PCA based methods still face challenges related to multiscale analysis and capturing higher-order interactions in the data. To address these challenges, we propose a novel approach called Persistent Laplacian-enhanced Principal Component Analysis (PLPCA). PLPCA amalgamates the advantages of earlier regularized PCA methods with persistent spectral graph theory, specifically persistent Laplacians derived from algebraic topology. In contrast to graph Laplacians, persistent Laplacians enable multiscale analysis through filtration and can incorporate higher-order simplicial complexes to capture higher-order interactions in the data. We evaluate and validate the performance of PLPCA using ten benchmark microarray data sets that exhibit a wide range of dimensions and data imbalance ratios. Our extensive studies over these data sets demonstrate that PLPCA provides up to 12% improvement to the current state-of-the-art PCA models on five evaluation metrics for classification tasks after dimensionality reduction.",4,Principal Component Analysis (PCA) has served as the baseline approach for dimensionality reduction in gene expression data analysis.
Automatic segmentation of large-scale CT image datasets for detailed body composition analysis.,37723444,https://pubmed.ncbi.nlm.nih.gov/37723444/,https://doi.org/10.1186/s12859-023-05462-2,"['Body composition', 'Computed tomography', 'Deep learning', 'Medical imaging', 'Segmentation']","Body composition (BC) is an important factor in determining the risk of type 2-diabetes and cardiovascular disease. Computed tomography (CT) is a useful imaging technique for studying BC, however manual segmentation of CT images is time-consuming and subjective. The purpose of this study is to develop and evaluate fully automated segmentation techniques applicable to a 3-slice CT imaging protocol, consisting of single slices at the level of the liver, abdomen, and thigh, allowing detailed analysis of numerous tissues and organs.",1,Body composition (BC) is an important factor in determining the risk of type 2-diabetes and cardiovascular disease.
DeepCAC: a deep learning approach on DNA transcription factors classification based on multi-head self-attention and concatenate convolutional neural network.,37723425,https://pubmed.ncbi.nlm.nih.gov/37723425/,https://doi.org/10.1186/s12859-023-05469-9,"['Attention mechanism', 'Bioinformatics', 'Convolutional neural networks', 'DNA transcription factors sequence']","Understanding gene expression processes necessitates the accurate classification and identification of transcription factors, which is supported by high-throughput sequencing technologies. However, these techniques suffer from inherent limitations such as time consumption and high costs. To address these challenges, the field of bioinformatics has increasingly turned to deep learning technologies for analyzing gene sequences. Nevertheless, the pursuit of improved experimental results has led to the inclusion of numerous complex analysis function modules, resulting in models with a growing number of parameters. To overcome these limitations, it is proposed a novel approach for analyzing DNA transcription factor sequences, which is named as DeepCAC. This method leverages deep convolutional neural networks with a multi-head self-attention mechanism. By employing convolutional neural networks, it can effectively capture local hidden features in the sequences. Simultaneously, the multi-head self-attention mechanism enhances the identification of hidden features with long-distant dependencies. This approach reduces the overall number of parameters in the model while harnessing the computational power of sequence data from multi-head self-attention. Through training with labeled data, experiments demonstrate that this approach significantly improves performance while requiring fewer parameters compared to existing methods. Additionally, the effectiveness of our approach  is validated in accurately predicting DNA transcription factor sequences.",1,DeepCAC is a novel approach for analyzing DNA transcription factor sequences. It leverages deep convolutional neural networks with a multi-head self-attention mechanism.
MAVEN: compound mechanism of action analysis and visualisation using transcriptomics and compound structure data in R/Shiny.,37715141,https://pubmed.ncbi.nlm.nih.gov/37715141/,https://doi.org/10.1186/s12859-023-05416-8,"['Causal reasoning', 'Mechanism of action', 'Shiny', 'Systems biology', 'Transcriptomics']","Understanding the Mechanism of Action (MoA) of a compound is an often challenging but equally crucial aspect of drug discovery that can help improve both its efficacy and safety. Computational methods to aid MoA elucidation usually either aim to predict direct drug targets, or attempt to understand modulated downstream pathways or signalling proteins. Such methods usually require extensive coding experience and results are often optimised for further computational processing, making them difficult for wet-lab scientists to perform, interpret and draw hypotheses from.",1," Computational methods to aid MoA elucidation usually either aim to predict direct drug targets, or attempt to understand modulated downstream pathways or signalling proteins."
Mixtures of strategies underlie rodent behavior during reversal learning.,37708113,https://pubmed.ncbi.nlm.nih.gov/37708113/,https://doi.org/10.1371/journal.pcbi.1011430,[],"In reversal learning tasks, the behavior of humans and animals is often assumed to be uniform within single experimental sessions to facilitate data analysis and model fitting. However, behavior of agents can display substantial variability in single experimental sessions, as they execute different blocks of trials with different transition dynamics. Here, we observed that in a deterministic reversal learning task, mice display noisy and sub-optimal choice transitions even at the expert stages of learning. We investigated two sources of the sub-optimality in the behavior. First, we found that mice exhibit a high lapse rate during task execution, as they reverted to unrewarded directions after choice transitions. Second, we unexpectedly found that a majority of mice did not execute a uniform strategy, but rather mixed between several behavioral modes with different transition dynamics. We quantified the use of such mixtures with a state-space model, block Hidden Markov Model (block HMM), to dissociate the mixtures of dynamic choice transitions in individual blocks of trials. Additionally, we found that blockHMM transition modes in rodent behavior can be accounted for by two different types of behavioral algorithms, model-free or inference-based learning, that might be used to solve the task. Combining these approaches, we found that mice used a mixture of both exploratory, model-free strategies and deterministic, inference-based behavior in the task, explaining their overall noisy choice sequences. Together, our combined computational approach highlights intrinsic sources of noise in rodent reversal learning behavior and provides a richer description of behavior than conventional techniques, while uncovering the hidden states that underlie the block-by-block transitions.",3,"In a reversal learning task, mice display noisy and sub-optimal choice transitions even at the expert stages of learning."
Mining the nanotube-forming ,37701018,https://pubmed.ncbi.nlm.nih.gov/37701018/,https://doi.org/10.1016/j.csbj.2023.08.031,"['Antifungal activity', 'Bacillus', 'Biofactory', 'Biosynthesis-related gene clusters', 'Candida albicans', 'Candida auris', 'Comparative genomics', 'Cytotoxicity', 'Genome mining']",There is a global health concern associated with the emergence of the multidrug-resistant (MDR) fungus ,1,There is a global health concern associated with the emergence of the multidrug-resistant (MDR) fungus.
Identification of the H3K36me3 reader LEDGF/p75 in the pancancer landscape and functional exploration in clear cell renal cell carcinoma.,37675289,https://pubmed.ncbi.nlm.nih.gov/37675289/,https://doi.org/10.1016/j.csbj.2023.08.023,"['Clear cell renal cell carcinoma', 'H3K36me3', 'LEDGF/p75', 'Pancancer', 'SETD2']","Lens epithelium-derived growth factor (LEDGF/p75) is a reader of epigenetic marks and a potential target for therapeutic intervention. Its involvement in human immunodeficiency virus (HIV) integration and the development of leukemia driven by MLL (also known as KMT2A) gene fusion make it an attractive candidate for drug development. However, exploration of LEDGF/p75 as an epigenetic reader of H3K36me3 in tumors is limited. Here, for the first time, we analyze the role of LEDGF/p75 in multiple cancers via multiple online databases and in vitro experiments. We used pancancer bulk sequencing data and online tools to analyze correlations of LEDGF/p75 with prognosis, genomic instability, DNA damage repair, prognostic alternative splicing, protein interactions, and tumor immunity. In summary, the present study identified that LEDGF/p75 may serve as a prognostic predictor for tumors such as adrenocortical carcinoma, kidney chromophobe, liver hepatocellular carcinoma, pancreatic adenocarcinoma, skin cutaneous melanoma, and clear cell renal cell carcinoma (ccRCC). In addition, in vitro experiments and gene microarray sequencing were performed to explore the function of LEDGF/p75 in ccRCC, providing new insights into the pathogenesis of the nonmutated SETD2 ccRCC subtype.",1,Lens epithelium-derived growth factor (LEDGF/p75) is a reader of epigenetic marks and a potential target for therapeutic intervention.
Artificial Intelligence framework with traditional computer vision and deep learning approaches for optimal automatic segmentation of left ventricle with scar.,37673578,https://pubmed.ncbi.nlm.nih.gov/37673578/,https://doi.org/10.1016/j.artmed.2023.102610,"['Automatic segmentation', 'Cardiac segmentation', 'Deep learning', 'Left ventricle', 'Machine learning', 'Scars', 'U-net', 'Unsupervised']","Automatic segmentation of the cardiac left ventricle with scars remains a challenging and clinically significant task, as it is essential for patient diagnosis and treatment pathways. This study aimed to develop a novel framework and cost function to achieve optimal automatic segmentation of the left ventricle with scars using LGE-MRI images. To ensure the generalization of the framework, an unbiased validation protocol was established using out-of-distribution (OOD) internal and external validation cohorts, and intra-observation and inter-observer variability ground truths. The framework employs a combination of traditional computer vision techniques and deep learning, to achieve optimal segmentation results. The traditional approach uses multi-atlas techniques, active contours, and k-means methods, while the deep learning approach utilizes various deep learning techniques and networks. The study found that the traditional computer vision technique delivered more accurate results than deep learning, except in cases where there was breath misalignment error. The optimal solution of the framework achieved robust and generalized results with Dice scores of 82.8 ± 6.4% and 72.1 ± 4.6% in the internal and external OOD cohorts, respectively. The developed framework offers a high-performance solution for automatic segmentation of the left ventricle with scars using LGE-MRI. Unlike existing state-of-the-art approaches, it achieves unbiased results across different hospitals and vendors without the need for training or tuning in hospital cohorts. This framework offers a valuable tool for experts to accomplish the task of fully automatic segmentation of the left ventricle with scars based on a single-modality cardiac scan.",1,Automatic segmentation of the cardiac left ventricle with scars remains a challenging and clinically significant task.
